<?xml version="1.0" encoding="ISO-8859-1"?>
 <courseCatalog 
            xmlns:xsd="http://www.w3.org/2001/XMLSchema"
            xmlns:xsi="http://www.w3.org/2001/XMLSchema-instance"
            xsi:schemaLocation="http://www.cs.umn.edu/4131/ns/catalog   Catalog.xsd" >


<course>
   <title> Internet Programming </title> 
  <instructor  title="Prof">  
       <firstname>  Anand </firstname> 
       <lastname>  Tripathi </lastname> 
  </instructor>
  <number>CS4131</number>
  <schedule>  
            <lecture day="Tue">10:30-11:30</lecture>
            <lecture day="Th">10:30-11:30</lecture>
  </schedule>  
   <semester>Fall</semester>
   <enrollment>10</enrollment>
</course>


<course>
  <title> Operating Systems </title> 
  <instructor  title="Dr">  
       <firstname>  Abhishek </firstname> 
       <lastname>  Chandra </lastname> 
  </instructor>
  <number>CS4061</number>
  <schedule>  
            <lecture day="Mon">10:30-11:30</lecture>
            <lecture day="Wed">10:30-11:30</lecture>
  </schedule>  
   <semester>Spring</semester>
   <enrollment>100</enrollment>
</course>


</courseCatalog>