<?xml version="1.0" encoding="ISO-8859-1"?>
 <courseCatalog xmlns="http://www.cs.umn.edu/4131/ns/catalog"
            xmlns:xsd="http://www.w3.org/2001/XMLSchema"
            xmlns:xsi="http://www.w3.org/2001/XMLSchema-instance"
            xsi:schemaLocation="http://www.cs.umn.edu/4131/ns/catalog   Catalog.xsd" >

<course>
  <title> Python Programming </title> 
  <instructor  title="Prof">  
       <firstname>  Sing </firstname> 
       <lastname>  Song </lastname> 
  </instructor>
  <instructor  title="Dr">  
       <firstname>  Ping </firstname> 
       <lastname>  Pong </lastname> 
  </instructor>
  <instructor>  
       <firstname>  Tim </firstname> 
       <lastname>  Tom </lastname> 
  </instructor>
  <number>CS4131</number>
  <schedule>  
            <lecture day="Mon">10:30-11:30</lecture>
            <lecture day="Wed">10:30-11:30</lecture>
  </schedule>  
   <semester>Fall</semester>
   <enrollment>50</enrollment>
</course>

<course>
  <title> BioGeog </title> 
  <instructor  title="Prof">  
       <firstname>  Scott </firstname> 
       <lastname>  George </lastname> 
  </instructor>
  <instructor  title="Prof">  
       <firstname>  Aaron </firstname> 
       <lastname>  Mallory </lastname> 
  </instructor>
  <instructor>  
       <firstname>  Tim </firstname> 
       <lastname>  Tom </lastname> 
  </instructor>
  <number>GE1403</number>
  <schedule>  
            <lecture day="Mon">10:30-11:30</lecture>
            <lecture day="Wed">10:30-11:30</lecture>
  </schedule>  
   <semester>Fall</semester>
   <enrollment>50</enrollment>
</course>


</courseCatalog>